clavePersonal,nombreCompleto,curp,correoElectronico,rol
31,Maria del Carmen Valdez Mendivil,VAMC670705MSRLNR07,maria.vm@huatabampo.tecnm.mx,
123,Guadalupe Maria Barreras Alvarez,BAAG760127MSRRLD02,guadalupe.ba@huatabampo.tecnm.mx,
173,Fatima Margarita Rojas Jocobi,ROJF830112MSRJCT02,fatima.rj@huatabampo.tecnm.mx,
122,Felix Jesus Ramirez Moroyoqui,RAMF810116HSRMRL07,felix.rm@huatabampo.tecnm.mx,
99,Gabriel Silvestre Antelo Gastelum,AEGG740324HSRNSB06,gabriel.ag@huatabampo.tecnm.mx,
126,Miguel Francisco Kameta Murillo,KAMM790929HSRMRG06,miguel.km@huatabampo.tecnm.mx,
